{
  "$schema": "https://json-schema.org/draft/2020-12/schema",
  "title": "Gate Intent Request",
  "type": "object",
  "required": [
    "schema_id",
    "schema_version",
    "created_at",
    "producer_version",
    "tool_name",
    "args",
    "targets",
    "context"
  ],
  "properties": {
    "schema_id": { "type": "string", "const": "gait.gate.intent_request" },
    "schema_version": { "type": "string", "pattern": "^1\\.0\\.0$" },
    "created_at": { "type": "string", "format": "date-time" },
    "producer_version": { "type": "string" },
    "tool_name": { "type": "string", "minLength": 1 },
    "args": { "type": "object" },
    "args_digest": { "type": "string", "pattern": "^[a-fA-F0-9]{64}$" },
    "intent_digest": { "type": "string", "pattern": "^[a-fA-F0-9]{64}$" },
    "script_hash": { "type": "string", "pattern": "^[a-fA-F0-9]{64}$" },
    "script": {
      "type": "object",
      "required": ["steps"],
      "properties": {
        "steps": {
          "type": "array",
          "minItems": 1,
          "items": {
            "type": "object",
            "required": ["tool_name", "args"],
            "properties": {
              "tool_name": { "type": "string", "minLength": 1 },
              "args": { "type": "object" },
              "targets": {
                "type": "array",
                "items": {
                  "type": "object",
                  "required": ["kind", "value"],
                  "properties": {
                    "kind": {
                      "type": "string",
                      "enum": ["path", "url", "host", "repo", "bucket", "table", "queue", "topic", "other"]
                    },
                    "value": { "type": "string", "minLength": 1 },
                    "operation": { "type": "string" },
                    "sensitivity": { "type": "string" },
                    "endpoint_class": {
                      "type": "string",
                      "enum": [
                        "fs.read",
                        "fs.write",
                        "fs.delete",
                        "proc.exec",
                        "net.http",
                        "net.dns",
                        "ui.click",
                        "ui.type",
                        "ui.navigate",
                        "other"
                      ]
                    },
                    "endpoint_domain": { "type": "string" },
                    "destructive": { "type": "boolean" },
                    "discovery_method": {
                      "type": "string",
                      "enum": ["webmcp", "dynamic_mcp", "a2a", "mcp", "static_mcp", "manual", "unknown"]
                    },
                    "read_only_hint": { "type": "boolean" },
                    "destructive_hint": { "type": "boolean" },
                    "idempotent_hint": { "type": "boolean" },
                    "open_world_hint": { "type": "boolean" }
                  },
                  "additionalProperties": false
                }
              },
              "arg_provenance": {
                "type": "array",
                "items": {
                  "type": "object",
                  "required": ["arg_path", "source"],
                  "properties": {
                    "arg_path": { "type": "string", "minLength": 1 },
                    "source": { "type": "string", "enum": ["user", "tool_output", "external", "system"] },
                    "source_ref": { "type": "string" },
                    "integrity_digest": { "type": "string", "pattern": "^[a-fA-F0-9]{64}$" }
                  },
                  "additionalProperties": false
                }
              }
            },
            "additionalProperties": false
          }
        }
      },
      "additionalProperties": false
    },
    "targets": {
      "type": "array",
      "items": {
        "type": "object",
        "required": ["kind", "value"],
        "properties": {
          "kind": {
            "type": "string",
            "enum": ["path", "url", "host", "repo", "bucket", "table", "queue", "topic", "other"]
          },
          "value": { "type": "string", "minLength": 1 },
          "operation": { "type": "string" },
          "sensitivity": { "type": "string" },
          "endpoint_class": {
            "type": "string",
            "enum": [
              "fs.read",
              "fs.write",
              "fs.delete",
              "proc.exec",
              "net.http",
              "net.dns",
              "ui.click",
              "ui.type",
              "ui.navigate",
              "other"
            ]
          },
          "endpoint_domain": { "type": "string" },
          "destructive": { "type": "boolean" },
          "discovery_method": {
            "type": "string",
            "enum": ["webmcp", "dynamic_mcp", "a2a", "mcp", "static_mcp", "manual", "unknown"]
          },
          "read_only_hint": { "type": "boolean" },
          "destructive_hint": { "type": "boolean" },
          "idempotent_hint": { "type": "boolean" },
          "open_world_hint": { "type": "boolean" }
        },
        "additionalProperties": false
      }
    },
    "arg_provenance": {
      "type": "array",
      "items": {
        "type": "object",
        "required": ["arg_path", "source"],
        "properties": {
          "arg_path": { "type": "string", "minLength": 1 },
          "source": { "type": "string", "enum": ["user", "tool_output", "external", "system"] },
          "source_ref": { "type": "string" },
          "integrity_digest": { "type": "string", "pattern": "^[a-fA-F0-9]{64}$" }
        },
        "additionalProperties": false
      }
    },
    "skill_provenance": {
      "type": "object",
      "required": ["skill_name", "source", "publisher"],
      "properties": {
        "skill_name": { "type": "string", "minLength": 1 },
        "skill_version": { "type": "string" },
        "source": { "type": "string", "minLength": 1 },
        "publisher": { "type": "string", "minLength": 1 },
        "digest": { "type": "string", "pattern": "^[a-fA-F0-9]{64}$" },
        "signature_key_id": { "type": "string" }
      },
      "additionalProperties": false
    },
    "delegation": {
      "type": "object",
      "required": ["requester_identity"],
      "properties": {
        "requester_identity": { "type": "string", "minLength": 1 },
        "scope_class": { "type": "string" },
        "token_refs": {
          "type": "array",
          "items": { "type": "string", "minLength": 1 }
        },
        "issued_at": { "type": "string", "format": "date-time" },
        "expires_at": { "type": "string", "format": "date-time" },
        "chain": {
          "type": "array",
          "items": {
            "type": "object",
            "required": ["delegator_identity", "delegate_identity"],
            "properties": {
              "delegator_identity": { "type": "string", "minLength": 1 },
              "delegate_identity": { "type": "string", "minLength": 1 },
              "scope_class": { "type": "string" },
              "token_ref": { "type": "string" },
              "issued_at": { "type": "string", "format": "date-time" },
              "expires_at": { "type": "string", "format": "date-time" }
            },
            "additionalProperties": false
          }
        }
      },
      "additionalProperties": false
    },
    "relationship": { "$ref": "#/$defs/relationship_envelope" },
    "context": {
      "type": "object",
      "required": ["identity", "workspace", "risk_class"],
      "properties": {
        "identity": { "type": "string", "minLength": 1 },
        "workspace": { "type": "string", "minLength": 1 },
        "risk_class": { "type": "string", "minLength": 1 },
        "phase": { "type": "string", "enum": ["plan", "apply"] },
        "agent_id": { "type": "string", "minLength": 1 },
        "agent_identity": {
          "type": "object",
          "properties": {
            "lifecycle_states": {
              "type": "array",
              "items": { "type": "string", "minLength": 1 }
            },
            "owner": { "type": "string", "minLength": 1 },
            "manifest_digest": { "type": "string", "pattern": "^[a-fA-F0-9]{64}$" },
            "publisher": { "type": "string", "minLength": 1 },
            "source": { "type": "string", "minLength": 1 },
            "issued_at": { "type": "string", "format": "date-time" },
            "approved_at": { "type": "string", "format": "date-time" },
            "expires_at": { "type": "string", "format": "date-time" },
            "revoked": { "type": "boolean" }
          },
          "additionalProperties": false
        },
        "run_id": { "type": "string", "minLength": 1 },
        "workflow_id": { "type": "string", "minLength": 1 },
        "repo": { "type": "string", "minLength": 1 },
        "environment": { "type": "string", "minLength": 1 },
        "job_id": { "type": "string", "minLength": 1 },
        "session_id": { "type": "string" },
        "request_id": { "type": "string" },
        "credential_ref": { "type": "string", "minLength": 1 },
        "credential_source": { "type": "string", "minLength": 1 },
        "credential_access_type": { "type": "string", "minLength": 1 },
        "credential_issuer": { "type": "string", "minLength": 1 },
        "credential_subject": { "type": "string", "minLength": 1 },
        "credential_owner": { "type": "string", "minLength": 1 },
        "credential_target_binding": { "type": "string", "minLength": 1 },
        "credential_run_binding": { "type": "string", "minLength": 1 },
        "credential_job_binding": { "type": "string", "minLength": 1 },
        "credential_ttl_seconds": { "type": "integer", "minimum": 1 },
        "approval_ref": { "type": "string", "minLength": 1 },
        "wrkr_inventory_ref": { "type": "string", "minLength": 1 },
        "agent_action_bom_ref": { "type": "string", "minLength": 1 },
        "auth_context": {
          "type": "object",
          "additionalProperties": true
        },
        "credential_scopes": {
          "type": "array",
          "items": { "type": "string", "minLength": 1 }
        },
        "environment_fingerprint": { "type": "string", "minLength": 1 },
        "context_set_digest": { "type": "string", "pattern": "^[a-fA-F0-9]{64}$" },
        "context_evidence_mode": { "type": "string", "enum": ["best_effort", "required"] },
        "context_refs": {
          "type": "array",
          "items": { "type": "string", "minLength": 1 }
        }
      },
      "additionalProperties": true
    }
  },
  "$defs": {
    "relationship_parent_ref": {
      "type": "object",
      "required": ["kind", "id"],
      "properties": {
        "kind": {
          "type": "string",
          "enum": ["trace", "run", "session", "intent", "policy", "agent", "evidence"]
        },
        "id": { "type": "string", "minLength": 1 }
      },
      "additionalProperties": false
    },
    "relationship_entity_ref": {
      "type": "object",
      "required": ["kind", "id"],
      "properties": {
        "kind": {
          "type": "string",
          "enum": ["agent", "tool", "resource", "policy", "run", "trace", "delegation", "evidence"]
        },
        "id": { "type": "string", "minLength": 1 }
      },
      "additionalProperties": false
    },
    "policy_ref": {
      "type": "object",
      "properties": {
        "policy_id": { "type": "string", "minLength": 1 },
        "policy_version": { "type": "string", "minLength": 1 },
        "policy_digest": { "type": "string", "pattern": "^(sha256:)?[a-f0-9]{64}$" },
        "matched_rule_ids": {
          "type": "array",
          "items": { "type": "string", "minLength": 1 },
          "uniqueItems": true
        }
      },
      "additionalProperties": false
    },
    "agent_link": {
      "type": "object",
      "required": ["identity", "role"],
      "properties": {
        "identity": { "type": "string", "minLength": 1 },
        "role": { "type": "string", "enum": ["requester", "delegator", "delegate"] }
      },
      "additionalProperties": false
    },
    "relationship_edge": {
      "type": "object",
      "required": ["kind", "from", "to"],
      "properties": {
        "kind": {
          "type": "string",
          "enum": ["delegates_to", "calls", "governed_by", "targets", "derived_from", "emits_evidence"]
        },
        "from": {
          "type": "object",
          "required": ["kind", "id"],
          "properties": {
            "kind": { "type": "string", "minLength": 1 },
            "id": { "type": "string", "minLength": 1 }
          },
          "additionalProperties": false
        },
        "to": {
          "type": "object",
          "required": ["kind", "id"],
          "properties": {
            "kind": { "type": "string", "minLength": 1 },
            "id": { "type": "string", "minLength": 1 }
          },
          "additionalProperties": false
        }
      },
      "additionalProperties": false
    },
    "agent_lineage": {
      "type": "object",
      "required": ["agent_id"],
      "properties": {
        "agent_id": { "type": "string", "minLength": 1 },
        "delegated_by": { "type": "string", "minLength": 1 },
        "delegation_record_id": { "type": "string", "minLength": 1 }
      },
      "additionalProperties": false
    },
    "relationship_envelope": {
      "type": "object",
      "properties": {
        "parent_ref": { "$ref": "#/$defs/relationship_parent_ref" },
        "entity_refs": {
          "type": "array",
          "items": { "$ref": "#/$defs/relationship_entity_ref" },
          "uniqueItems": true
        },
        "policy_ref": { "$ref": "#/$defs/policy_ref" },
        "agent_chain": {
          "type": "array",
          "items": { "$ref": "#/$defs/agent_link" }
        },
        "edges": {
          "type": "array",
          "items": { "$ref": "#/$defs/relationship_edge" },
          "uniqueItems": true
        },
        "parent_record_id": { "type": "string", "minLength": 1 },
        "related_record_ids": {
          "type": "array",
          "items": { "type": "string", "minLength": 1 },
          "uniqueItems": true
        },
        "related_entity_ids": {
          "type": "array",
          "items": { "type": "string", "minLength": 1 },
          "uniqueItems": true
        },
        "agent_lineage": {
          "type": "array",
          "items": { "$ref": "#/$defs/agent_lineage" }
        }
      },
      "additionalProperties": false
    }
  },
  "additionalProperties": false
}
