{
  "schema_id": "gait.gate.intent_request",
  "schema_version": "1.0.0",
  "created_at": "2026-02-05T00:00:00Z",
  "producer_version": "0.0.0-dev",
  "tool_name": "tool.write",
  "args": {
    "path": "/tmp/out.txt",
    "payload": {
      "tags": ["alpha", "beta"],
      "x": 2
    }
  },
  "targets": [
    { "kind": "path", "value": "/tmp/out.txt", "operation": "write" },
    { "kind": "host", "value": "api.internal" }
  ],
  "arg_provenance": [
    { "arg_path": "args.payload", "source": "tool_output", "source_ref": "trace_2" },
    { "arg_path": "args.path", "source": "user" }
  ],
  "context": {
    "identity": "alice",
    "workspace": "/repo/work",
    "risk_class": "high",
    "session_id": "s1"
  }
}
