{
  "schema_id": "gait.gate.intent_request",
  "schema_version": "1.0.0",
  "created_at": "2026-03-23T00:00:00Z",
  "producer_version": "0.0.0-example",
  "tool_name": "secret.read",
  "args": {
    "secret_name": "DATABASE_URL",
    "vault_path": "ci/production/database"
  },
  "targets": [
    {
      "kind": "other",
      "value": "vault://ci/production/database",
      "operation": "read"
    }
  ],
  "arg_provenance": [
    {
      "arg_path": "$.secret_name",
      "source": "system",
      "source_ref": "ci:env_config"
    }
  ],
  "context": {
    "identity": "ci-agent",
    "workspace": "/ci/workspace",
    "risk_class": "high"
  }
}
