{
  "schema_id": "gait.gate.intent_request",
  "schema_version": "1.0.0",
  "created_at": "2026-03-10T00:00:00Z",
  "producer_version": "0.0.0-example",
  "tool_name": "tool.deploy",
  "args": {
    "host": "deploy.internal.example"
  },
  "targets": [
    {
      "kind": "host",
      "value": "deploy.internal.example",
      "operation": "deploy"
    }
  ],
  "context": {
    "identity": "release-bot",
    "workspace": "/tmp/workspace",
    "environment": "prod",
    "risk_class": "high"
  }
}
