{"schema_id": "gait.gate.intent_request", "schema_version": "1.0.0", "created_at": "2026-02-18T00:00:00Z", "producer_version": "0.0.0-dev", "tool_name": "tool.write", "args": {"path": "/tmp/delegated.txt"}, "targets": [{"kind": "path", "value": "/tmp/delegated.txt", "operation": "write", "endpoint_class": "fs.write"}], "arg_provenance": [{"arg_path": "$.path", "source": "user"}], "delegation": {"requester_identity": "agent.worker", "scope_class": "write", "token_refs": ["694428976ab1b10859171a05", "7e37847cf7d9320eb0854cc8", "8a715283a36e6b05e9287e12"], "chain": [{"delegator_identity": "agent.lead", "delegate_identity": "agent.manager", "scope_class": "write", "token_ref": "694428976ab1b10859171a05"}, {"delegator_identity": "agent.manager", "delegate_identity": "agent.senior", "scope_class": "write", "token_ref": "7e37847cf7d9320eb0854cc8"}, {"delegator_identity": "agent.senior", "delegate_identity": "agent.worker", "scope_class": "write", "token_ref": "8a715283a36e6b05e9287e12"}]}, "context": {"identity": "agent.worker", "workspace": "/repo/gait", "risk_class": "high", "session_id": "sess-tier11"}}