{
  "schema_id": "gait.gate.intent_request",
  "schema_version": "1.0.0",
  "created_at": "2026-05-09T00:00:00Z",
  "producer_version": "0.0.0-example",
  "tool_name": "script",
  "args": {},
  "targets": [],
  "context": {
    "identity": "alice",
    "workspace": "/repo/gait",
    "risk_class": "low"
  },
  "script": {
    "steps": [
      {
        "tool_name": "tool.write",
        "args": {
          "path": "/tmp/out.txt"
        },
        "targets": [
          {
            "kind": "path",
            "value": "/tmp/out.txt",
            "operation": "write"
          }
        ]
      }
    ]
  }
}
