{
  "schema_id": "gait.gate.intent_request",
  "schema_version": "1.0.0",
  "created_at": "2026-05-09T00:00:00Z",
  "producer_version": "0.0.0-example",
  "tool_name": "tool.exec",
  "args": {
    "path": "/tmp/work/run.sh"
  },
  "targets": [
    {
      "kind": "path",
      "value": "/tmp/work/run.sh",
      "operation": "execute",
      "endpoint_class": "proc.exec"
    }
  ],
  "context": {
    "identity": "alice",
    "agent_id": "agent.exec",
    "workspace": "/repo/gait",
    "environment": "prod",
    "risk_class": "high"
  }
}
