{
  "schema_id": "gait.gate.intent_request",
  "schema_version": "1.0.0",
  "created_at": "2026-02-11T00:00:00Z",
  "producer_version": "0.0.0-example",
  "tool_name": "tool.write",
  "args": {
    "destination_host": "api.partner.example",
    "payload": "status=ok"
  },
  "targets": [
    {
      "kind": "host",
      "value": "api.partner.example",
      "operation": "write",
      "endpoint_class": "net.http",
      "endpoint_domain": "api.partner.example"
    }
  ],
  "arg_provenance": [
    {
      "arg_path": "$.payload",
      "source": "user"
    }
  ],
  "delegation": {
    "requester_identity": "agent.specialist",
    "scope_class": "write",
    "token_refs": ["delegation_valid_01"],
    "chain": [
      {
        "delegator_identity": "agent.lead",
        "delegate_identity": "agent.specialist",
        "scope_class": "write",
        "token_ref": "delegation_valid_01"
      }
    ]
  },
  "context": {
    "identity": "agent.specialist",
    "workspace": "/tmp/workspace",
    "risk_class": "high",
    "session_id": "sess_policy_valid",
    "run_id": "run-policy-delegated-valid",
    "job_id": "job-policy-delegated-valid",
    "credential_ref": "aws:sts:assumed-role/ci/1234567890",
    "credential_source": "aws_sts",
    "credential_access_type": "jit",
    "credential_issuer": "sts.amazonaws.com",
    "credential_ttl_seconds": 600,
    "credential_run_binding": "run-policy-delegated-valid",
    "credential_job_binding": "job-policy-delegated-valid"
  }
}
