{
  "schema_id": "gait.gate.intent_request",
  "schema_version": "1.0.0",
  "created_at": "2026-05-09T00:00:00Z",
  "producer_version": "0.0.0-example",
  "tool_name": "tool.exec",
  "args": {
    "path": "/tmp/work/run.sh"
  },
  "targets": [
    {
      "kind": "path",
      "value": "/tmp/work/run.sh",
      "operation": "execute",
      "endpoint_class": "proc.exec"
    }
  ],
  "context": {
    "identity": "release-bot",
    "workspace": "/tmp/workspace",
    "risk_class": "high",
    "sandbox": {
      "network_mode": "full",
      "writable_paths": ["/tmp/work/tmp"],
      "read_only_roots": ["/repo", "/usr/share"],
      "env_exposure_mode": "allowlist",
      "timeout_seconds": 30,
      "filesystem_isolation": "container",
      "user_mode": "unprivileged",
      "evidence_ref": "sandbox:receipt:v1",
      "evidence_digest": "bbbbbbbbbbbbbbbbbbbbbbbbbbbbbbbbbbbbbbbbbbbbbbbbbbbbbbbbbbbbbbbb"
    }
  }
}
