{
  "schema_id": "gait.gate.intent_request",
  "schema_version": "1.0.0",
  "created_at": "2026-03-23T00:00:00Z",
  "producer_version": "0.0.0-example",
  "tool_name": "deploy.apply",
  "args": {
    "environment": "production",
    "image": "app:sha-abc123"
  },
  "targets": [
    {
      "kind": "host",
      "value": "api.production.example",
      "operation": "write",
      "endpoint_class": "net.http",
      "endpoint_domain": "api.production.example"
    }
  ],
  "arg_provenance": [
    {
      "arg_path": "$.image",
      "source": "system",
      "source_ref": "ci:build_output"
    }
  ],
  "context": {
    "identity": "ci-agent",
    "workspace": "/ci/production",
    "risk_class": "critical"
  }
}
