{"schema_id":"gait.gate.intent_request","schema_version":"1.0.0","created_at":"2026-02-18T00:00:00Z","producer_version":"0.0.0-dev","tool_name":"tool.write","args":{"path":"/tmp/dry-run.txt"},"targets":[{"kind":"path","value":"/tmp/dry-run.txt","operation":"write","endpoint_class":"fs.write"}],"arg_provenance":[{"arg_path":"$.path","source":"user"}],"context":{"identity":"agent.scenario","workspace":"/repo/gait","risk_class":"high","session_id":"sess-tier11"}}
