{
  "schema_id": "gait.gate.intent_request",
  "schema_version": "1.0.0",
  "created_at": "2026-02-06T00:00:00Z",
  "producer_version": "0.0.0-example",
  "tool_name": "tool.write",
  "args": {
    "path": "/tmp/out.txt",
    "content": "hello"
  },
  "targets": [
    {
      "kind": "path",
      "value": "/tmp/out.txt"
    }
  ],
  "arg_provenance": [
    {
      "arg_path": "$.path",
      "source": "user"
    }
  ],
  "context": {
    "identity": "example-user",
    "workspace": "/tmp/workspace",
    "risk_class": "high",
    "run_id": "run-policy-write",
    "job_id": "job-policy-write",
    "credential_ref": "aws:sts:assumed-role/ci/1234567890",
    "credential_source": "aws_sts",
    "credential_access_type": "jit",
    "credential_issuer": "sts.amazonaws.com",
    "credential_ttl_seconds": 600,
    "credential_run_binding": "run-policy-write",
    "credential_job_binding": "job-policy-write"
  }
}
